<?xml version="1.0" encoding="utf-8" ?>
<book:books xmlns:book="http://www.assupg.cn/XMLSchema/02"
            xmlns:xsi="http://www.w3.org/2001/XMLSchema-instance"
            xsi:schemaLocation="http://www.assupg.cn/XMLSchema/02 02.xsd">
    <book:book id="1">
        <book:title>Java in action</book:title>
        <book:content>Java is good</book:content>
        <book:author>Bruce</book:author>
    </book:book>
    <book:book id="2">
        <book:title>SOA in action</book:title>
        <book:content>soa in difficult</book:content>
        <book:authors>
            <book:author>Jike</book:author>
        </book:authors>
    </book:book>
</book:books>